no, title, price, delivery_price, category 
300,"밀레 *MILLET* 남 녀 캐주얼 파라디 플리스후디자켓 *MVRFJ401* -16 블랙",55000,3000,10
301,"[A＆FITCH] 아베크롬비 그래픽 후드 집업 GRAY BLUE",59800,3000,10
302,"앨빈클로 곰돌이 자수 후드집업 AZH658",34510,3000,10
303,"앨빈클로 남녀공용 데일리 무지 기모 후드집업 AZH539",19928,3000,10
304,"[NBA] NYK KNICKS 리버시블 후드탈착 에어볼 플리스 점퍼(N214JP110P)",59000,3000,10
305,"아디다스 남녀공용 후드 집업 가벼운 레이어드 루즈핏 자켓 블랙+PGN짐쌕가방",49800,3000,10
306,"행텐 행텐 공용 베이직 셋업 테리 후드집업_045(10410-034-252-11)",28420,3000,10
307,"행텐 공용 23F/W 가볍고보온성이좋은 포켓 쉐르파 플리스 후드집업(상세설명참조) 뉴코아울산성남",19950,3000,10
308,"후아유 기모 시그니처 패치 후드집업 (WHMZD4911U)",33150,3000,10
309,"메이크잇 ROKA 로카 군용 방한 보아털 자수후리스 블랙",26900,3000,10
310,"아디다스보아후드집업자켓HN0670",45000,3000,10
311,"네이븐 이지 오버핏 기모 후드집업 N19HZ",18122,3000,10
312,"락사이코 오버핏 스트릿 양팔나염 레터링 쭈리원단 후드집업",37000,3000,10
313,"뉴발란스 W 코스믹 기모 자켓 NBMD746032 (2종택1) 남여후드집업자켓",29900,3000,10
314,"후드 판쵸 블랑켓",14400,3000,10
315,"체이스컬트 DP03 공용 플리스 후드집업 AFZU4302D03",39900,3000,10
316,"칼하트 J140 플러스 코튼 바람막이 덕 엑티브 자켓",108900,3000,10
317,"플루크 인터네셔널 후드집업 FZT103",34180,3000,10
318,"워나샵 국내제작 경이로운 소문 츄리닝바지 트레이닝팬츠 시보리조거(하의) 남여공용",9900,3000,10
319,"CH-F1 오버핏 양면 후리스 집업",21900,3000,10
320,"해병대 팔각모해골 특양면 후드집업 티셔츠",38000,3000,10
321,"DREW HOUSE 드류하우스 후드집업 데일리룩",89800,3000,10
322,"남여공용 두터운 후드 집업 자켓 인조 밍크",74500,3000,10
323,"[후아유] 리버서블 퀼팅 덤블베스트 (WHVWB4T31U-T)",19710,3000,10
324,"베이직플러스 무지 후드 집업 조끼 BBK-106",22890,3000,10
325,"행텐주니어 행텐틴즈 리사이클 타프트퍼 플리스 후드점퍼_100(14390-010-804-69)",17510,3000,10
326,"[매장정품] 내셔널지오그래픽 플리스 집업 후리스 자켓 뽀글이 남녀공용 가을 겨울 점퍼",105000,3000,10
327,"나이키 NSW 테크 플리스 윈드러너 후드집업 CU4490-010",115510,3000,10
328,"고스트리퍼블릭 오버 스트랩 프린팅 오버핏 후드집업 GHZ-262",29002,3000,10
329,"군인 ROKA 로카후리스 풀자수 프리미엄 밍크 군대 군용 블랙 검정 코리아아미",29800,3000,10
330,"네스파 르메레드 빅사이즈 커플 후드 집업 SHN_0012",32810,3000,10
331,"언더아머 후드 집업 자켓 APAC 본디드 플리스 후드 재킷 기모 남녀공용 1376614",88960,3000,10
332,"군용 군대 군인 ROKA 로카후리스 군인후리스 간절기후리스",9900,3000,10
333,"게스 보아 플리스 후드 집업 남자 여자 점퍼 남녀공용 + 사은품",45990,3000,10
334,"NBA [NBA]LAL LAKERS 폴라플리스 리버서블 후드점퍼(N213JP111P)",39000,3000,10
335,"[쉐비뇽(CHEVIGNON)] ○ 23FW 여성 니트카라 다운 점퍼",66000,3000,10
336,"행텐 솔리드 무지 기모 후드집업",44920,3000,10
337,"칼하트 J130 자켓 구제 빈티지 아메리칸 자켓 점퍼 레트로 후드집업",139000,3000,10
338,"메이리앤 루즈핏 떡볶이 코트 더플코트 양털 뽀글이 롱 후리스",25850,3000,10
339,"아디다스 마샬아츠 트랙탑 져지 자켓 TTR10030M 남여공용 + 마스크",69000,3000,10
340,"나이키 NSW 클럽 플리스 후드 집업 블랙 여자 트레이닝 기모 풀집 자켓 점퍼 후디 DC7118-010",51800,3000,10
341,"남녀공용 베이직 오버핏 토끼 후드집업 블랙",12600,3000,10
342,"남녀공용 베이직 오버핏 토끼 후드집업 아이보리",12600,3000,10
343,"남녀공용 베이직 오버핏 토끼 후드집업 그레이",12600,3000,10
344,"캐럿 유니섹스 덤블 플리스 자켓",15990,3000,10
345,"플루크 월드 슬램로고 후드집업 FZT1023",46580,3000,10
346,"뱅뱅 [동아수성] 남녀공용 밍크 기모 후드집업(BBANTE682)",29000,3000,10
347,"언더아머 APAC 본디드 플리스 자켓 겨울 양털기모 집업 후리스 남녀공용 1376615",79980,3000,10
348,"[스파이더 본사] 여성 슬림 조거 팬츠 SPHPCNFP351WLGR",69700,3000,10
349,"남자 여자 남녀공용 겨울 간절기 기모 털 후드집업 후드티 자켓 검정 회색",11200,3000,10
350,"남자 여자 남녀공용 겨울 간절기 기모 털 후드집업 후드티 자켓 검정 회색",11200,3000,10
351,"캐럿 남녀공용 폴라플리스 후드 자켓",15990,3000,10
352,"임영웅 굿즈 후드집업 티셔츠",23800,3000,10
353,"[스파이더 본사] 공용 루즈핏 조거팬츠 SPHPCNFP304UMGR",83400,3000,10
354,"[에잇세컨즈] 슬리브 배색 바시티 점퍼 그린 (263X39GY2M)",79900,3000,10
355,"엘투에스 노르딕자켓",23900,3000,10
356,"고스트리퍼블릭 액션 포켓 포인트 터틀 후드집업 GHZ 246",34110,3000,10
357,"빌락트 마약기모 베이직 무지 후드 집업",26290,3000,10
358,"베이프 bape 샤크 헤드 후드 기모 점퍼 남여공용 캐주얼 커플룩 오버핏",36500,3000,10
