no, title, price, delivery_price, category 
61,"더림 농구 맨투맨 오버핏 라운드 긴팔 기모 티셔츠 단체 남녀공용",32500,3000,6
62,"클로니아 데님 진마니아 후드티 TG-537",23800,3000,6
63,"벤힛 NOTOVER 세미 오버핏 특양면 맨투맨",17220,3000,6
64,"행텐 [행텐] 공용 휴 스포티 후드 티셔츠_053(10380-031-631-11)",15950,3000,6
65,"챔피온 S0888 파워블렌드 맨투맨 BLACK",33520,3000,6
66,"프리코드 남녀공용 오버핏 라인 맨투맨 빅사이즈 운동복 트레이닝복 상의",16000,3000,6
67,"더팀 빅사이즈 USA 기모 후드티",26323,3000,6
68,"NII 아동 레터링 후드 맨투맨 NNKAMUX8311",2900,3000,6
69,"남녀공용 내셔널 라운드 맨투맨 티셔츠",39000,3000,6
70,"리복 리복 로고포인트 라운드 맨투맨 여성 오트밀",20050,3000,6
71,"미항공 우주국 나사 후드 티",29000,3000,6
72,"알럽홈 오프우주인 맨투맨",6730,3000,6
73,"에비수 루즈핏 그라데이션 빅힐스 후드_ET4UTS702",54500,3000,6
74,"네이븐 오버핏 후드티 NA2203H",25900,3000,6
75,"체이스컬트 3Color 커플 기모 후드-티셔츠",9200,3000,6
76,"엘라모 기모H 무지 후드티",25850,3000,6
77,"제이비패션 곰인형 기모맨투맨",21900,3000,6
78,"지프 NC고잔점 70%할인 남녀공용 오버핏 등판 지프산맥 프린팅 스몰지프 후드티",29700,3000,6
79,"엘라모 기모M 공룡 맨투맨",20070,3000,6
80,"앨빈클로 무지 오버핏 더블 코튼 맨투맨 MAR749 (7 COLOR) 그레이 L",24900,3000,6
81,"YALE 투톤 nct dream127 그레이풀오버후드",26660,3000,6
82,"[국내매장정품] LEE 상의 빅트위치 루즈핏 후드 네이비",66350,3000,6
83,"앨빈클로 아크로 오버핏 기모 후드티 AVH191",34900,3000,6
84,"앨빈클로 공용 스노보딩 베어 기모 후드티 AVH137",28860,3000,6
85,"[국내매장정품] LEE 상의 빅트위치 루즈핏 후드 블랙",67140,3000,6
86,"블루포스 남녀공용 텝스 맨투맨 빅사이즈 긴팔티셔츠",25800,3000,6
87,"(국내매장판/AS가능) 내셔널지오그래픽 N214USW060 남여공용 폴리카터 BIG LOGO MTM (풀기모)",63900,3000,6
88,"남녀공용 퓨어 울 체크 맨투맨(3color)",45000,3000,6
89,"지프 [NC불광점]가을겨울상품 70%할인! 심플하고 베이직한 디자인의 남여공용 맨투맨티셔츠!! 데일리아이템!!",20700,3000,6
90,"남여공용 고급 국산 회색 특양면 맨투맨 Lg 야구 2023 우승 기념 맨투맨",14900,3000,6
91,"에어플레인 몬트리올 스탠다드 맨투맨",19700,3000,6
92,"앨빈클로 무지 오버핏 후드티 AVH-855",28350,3000,6
93,"메이리앤 남여공용 오버핏 기모 후드 티셔츠",15090,3000,6
94,"어반에이지 NEW 센서티브 오버 기모 맨투맨 (기모 안감) (9 Colors)",19800,3000,6
95,"벤힛 Evning 세미 오버핏 특양면 빅사이즈 맨투맨",20890,3000,6
96,"면 100 쮸리 기모 오버핏 와이드베어 맨투맨",26910,3000,6
97,"게스 유니 기모쭈리 로고 프린트 맨투맨 NN4K0262",35600,3000,6
98,"제이비패션 럭키곰 맨투맨",19920,3000,6
99,"JEEP spirit (지프스피릿) 기모 후드티셔츠 남.여공용 HD-6549B",39000,3000,6
100,"카멜워크 어센틱 로고 스웨트 셔츠",29010,3000,6
101,"라파클럽 남녀공용 피케 집업 긴팔 후드 티셔츠",53800,3000,6
102,"칼카니 마블정품 봄가을 특양면 두니엘 후드 M-3XL",29800,3000,6
103,"나이키 SB 스케이트보드 기모 후드티 CW4383",49000,3000,6
104,"지프 불광점 (50%할인) ﻿남녀공용 ﻿ 백프린팅과 포켓주머니가 특징인 맨투맨 티셔츠 !! (JN1TSU803)",44500,3000,6
105,"오티디 3단쮸리기모 남녀공용 오버핏 불독 맨투맨",27810,3000,6
106,"베이직하우스 세미 오버핏 맨투맨 LWTS0101",30200,3000,6
107,"벤힛 그루브 세미 오버핏 특양면 맨투맨",15260,3000,6
108,"[더팀] NYC 기모 후드티 남여공용 빅사이즈 4XL까지",34900,3000,6
109,"앨빈클로 빅 어썸 오버핏 후드티 AVH176",29900,3000,6
110,"캐럿 남녀공용 특양면 맨투맨 8컬러",12690,3000,6
111,"MLB 빈티지 플라워 프린트 긴팔 맨투맨 남녀 캐주얼 코디 커플",69800,3000,6
112,"그랜피니 스파이더 후드 티셔츠 GFHT202",38900,3000,6
113,"제이비패션 어부바 맨투맨",16150,3000,6
114,"네스파 일기타곰 맨투맨 SMD_0008",25170,3000,6
115,"[칼카니] Hit 아이템 고르곤 후드티/프리미엄원단/빅사이즈(M-3XL)",23800,3000,6
116,"매드문 글로벌워닝 자수포인트 빅사이즈 기모후드",23310,3000,6
117,"크루클린 무지 기모 후드 티셔츠 HRL600",17502,3000,6
118,"지프 NC고잔점 특가상품 남녀공용 기모 오버핏 컬러블러킹 반넥 아노락 후드티",53700,3000,6
119,"에비수 공용 5종 루즈핏 힐스 영문 후드 티셔츠 EU5UTS941",24900,3000,6
120,"앨빈클로 사일런트 힐 오버핏 후드티 AVH-864",31900,3000,6
r",10320,3000,5
177,"[에잇세컨즈] 코튼 오버핏 셔츠 네이비 (423864HY1R)",19900,3000,5
178,"자라 ZARA 남성 지오메트릭 자카드 셔츠269146",22100,3000,5
179,"[TBJ] 여성 루즈핏 코튼 피그먼트 셔츠(T201SH630P)",15000,3000,5
180,"[에잇세컨즈] 코듀로이 셔츠 블랙 (323964LY15)",19900,3000,5
