no, title, price, delivery_price, category 
539,"삼성 그랑데 의류 건조기 정품 올인원 먼지필터 DV14N8520KP DV14N8500KP, 1개",49800,3000,14
540,"삼성전자 BESPOKE 그랑데 AI 드럼세탁기 + 건조기 WF24B8200KW2L 24kg + 20kg + 상단 설치 키트 세트 방문설치, 화이트",1814600,3000,14
541,"시티파이 스타일랩 미니 의류관리기 소형 건조기 1인 스타일에어, 시티화이트, 1EA 세트 :: [수트케이스/후크 각 1ea 증정]",99000,3000,14
542,"삼성전자 비스포크 그랑데 AI 드럼세탁기 21kg + 건조기 17kg + 상단 설치 키트 WF21DV17WWL 방문설치, WF21A9400KW(세탁기), DV17A9720BW(건조기), 화이트",1699940,3000,14
543,"하이얼 1등급 온수가능 일반소형 통돌이 세탁기 4kg, HWM40FTW, 퓨어 화이트",192670,3000,14
544,"삼성 정품 DV14N8520KV 사용 의류건조기 인버터 라운드 필터세트 (겉+속) (HJ솔B 증정)",49000,3000,14
545,"LG전자 LG 정품 건조기 필터 8/ 9kg, 1개, A형 SET AGM75510732",39800,3000,14
546,"삼성전자 BESPOKE 그랑데 AI 세탁기 직렬설치 패키지 WF24B8200KE2L 세탁기 24kg + 건조기 20kg 방문설치, 그레이지",1814600,3000,14
547,"삼성 정품 의류건조기 필터 20665D 겉필터 속필터 세트, 1개",53000,3000,14
548,"한일 미니 만능 짤순이 탈수기 1kg NW-Y2020",99900,3000,14
549,"한일 미니건조기 5KG 빨래 소형 수건 HLD-5000W",368980,3000,14
550,"LG 의류건조기용 정품 보푸라기필터 RH14WH RH14VH, 1개, 이너+아우터 세트",43000,3000,14
551,"비스카 투인원 미니세탁기 MR-H100WM, 블랙 + 화이트",67470,3000,14
552,"삼성 정품 그랑데 DV14R8520KP DV14R8520KW DV14R8540KP 의류건조기 외부 케이스+내부 필터 필터세트, 의류건조기 필터 세트 DC97-20665D",56700,3000,14
553,"삼성 그랑데 건조기 정품 올인원 먼지 필터 DV16R8520KP DV16T8520BP DV16T8740BP DV16T9720SP DV17A9740CP DV17B8720BP",59800,3000,14
554,"케이트가든 가죽 세탁기커버 + 논슬립매트, 1개, 차콜",15450,3000,14
555,"LG 삼성 드럼 세탁기 위에 모든 건조기 선반 앵글 없이 직렬 설치 / 듀오스탠드 건조기 키트, 삼성드럼(그랑데/비스포크)16Kg이상, LG건조기10Kg이하, 1개",93800,3000,14
556,"삼성전자 인버터 건조기 DV90T5540BV 9kg 방문설치, 블랙 케비어",663040,3000,14
557,"삼성 정품 DF10A9500 전용 에어드레서 전용 바지무게추, 1개",27300,3000,14
558,"삼성 그랑데 의류 건조기 정품 올인원 먼지필터 DV14N8520KV DV14N8520KW, 1개",49800,3000,14
559,"LG전자 통돌이 세탁기 T19MX7 19kg 방문설치, 미드 블랙",665200,3000,14
560,"미디어 전자동 세탁기 MWH-A70P1 7kg 방문설치, 화이트",239000,3000,14
561,"소싱 제로 신발 건조기 DSHJ-S-1904 265g, DSHJ-S-1904(애쉬)",24900,3000,14
562,"LG 스타일러 S5MBUA 5벌 블랙 틴트 미러 방문설치",1383350,3000,14
563,"한일전기 소형 건조기 에어 UV 미니 의류관리기, 크림베이지",99900,3000,14
564,"(정품) 삼성 건조기 내부+외부 필터세트 DV90K6200IW DV90K6200QW DV90M52A0QW",33000,3000,14
565,"코알라 세탁기 배수 호스 2M, 1개",3500,3000,14
566,"소싱 제로 신발 건조기 퍼플, DSHJ-S-1904(퍼플)",24900,3000,14
567,"LG 정품 트롬 스타일러 의류관리기 정품 급수통 배수통 물통(HJ스마트톡 증정), 2. 스타일러 배수통(물버림)",28900,3000,14
568,"삼성 정품 그랑데 DV14R8540KV DV16R8540KP DV16R8540KW 의류건조기 외부 케이스+내부 필터 필터세트",56000,3000,14
569,"[청소고집] 세탁기 분해 청소 드럼 통돌이 세탁조 통 세척 분해 청소 업체, 아기사랑 미니통돌이",69000,3000,14
570,"미디어 인버터 히트펌프 전기 의류 건조기 MCD-H103W 10kg 방문설치 화이트",579000,3000,14
571,"히츠 UV라이트 미니건조기 HD-400GES 4kg, 화이트",249000,3000,14
572,"삼성전자 건조기 DV90TA040TE 9kg 방문설치 화이트",639480,3000,14
573,"나오나 LG 플라스틱 크린 필터 세탁기 거름망 먼지망 통돌이 인버터 호환, 1개, T17WX3",4500,3000,14
574,"미디어 드럼 세탁기 MW-F902W 9kg 방문설치, 화이트",399000,3000,14
575,"대웅 전자동 세탁기 3.5kg, DWW-M400WS, 화이트",159000,3000,14
576,"삼성전자 그랑데 통버블 세탁기 WA21A8376KV 21kg 방문설치, 블랙 케비어",680780,3000,14
577,"(정품) 삼성 의류 건조기 DC68-03808A-01 먼지 보풀 필터 (내부/외부 선택), 1개, 내부(속) 필터",19500,3000,14
578,"LG 통돌이 세탁기 TR10BL 10kg 미들 프리 실버 방문설치, 미드 프리 실버",384550,3000,14
579,"온가담 휴대용 옷 건조기, 0GD-LV01-MS21B, 화이트",59670,3000,14
580,"LG전자 통돌이 일반세탁기 12kg TR12WL 정품 LG기사 친절 설치상품, 화이트",379900,3000,14
581,"크로반 휴대용 신발 건조기 KRV_D1, 베이지",48900,3000,14
582,"아기세탁기 전자동 미니 세탁기 속옷 세탁기3KG (세탁탈수일체기), 노란색",77600,3000,14
583,"LG 트롬 건조기 먼지 보푸라기 필터 세트 18 kg 이상 RD20DJD RD19WNC, AGM30050402, 1개",55800,3000,14
584,"LG전자 통돌이 세탁기 T18DX7 18kg 방문설치, 미드 프리 실버",624470,3000,14
585,"하이얼 소형 통돌이 세탁기 6kg 방문설치, HW60G, 화이트",299720,3000,14
586,"에코웰 크린탈수기 의류탈수기 음식물탈수기 내통완전분리 T30-158A 3kg",79000,3000,14
587,"와이넷 세탁기 배수 연장호스 2.5m, 1개",15210,3000,14
588,"신일 1등급 삶는 미니 세탁기 SWM-1500WSJ 3KG, 화이트",254100,3000,14
589,"아기세탁기 전자동 미니 세탁기 속옷 세탁기3KG (세탁탈수일체기), 녹색",77600,3000,14
590,"LG전자 스마트인버터모터 통돌이 일반세탁기 TR12BL 12kg 방문설치, 미들 프리 실버",399450,3000,14
591,"삼성전자 그랑데 통버블 세탁기 WA10CG5441BW 10kg 방문설치, 화이트",368320,3000,14
592,"삼성전자 그랑데 통버블 세탁기 WA16CG6441BY 16kg 방문설치, 라벤더그레이",462960,3000,14
593,"삼성 그랑데 건조기 정품 올인원 먼지 필터 DV20B9720BB DV20B9760CB DV14R8540KV DV14T8520BV DV16R8540KV DV16T8740BV",59800,3000,14
594,"삼성 9킬로 건조기 2단 직렬 설치 스테킹 키트 SKK-TKV 블랙 케비어 TKW 화이트, 블랙케비어",79800,3000,14
595,"와이넷 슬림 꼭지 냉온수 세트, 1세트",29800,3000,14
596,"한일 UV살균 5kg 미니 의류건조기 HLD-5100W, 혼합색상",419900,3000,14
597,"LG전자 트롬 드럼세탁기 F24WDWP 24kg 방문설치, 화이트(유광)",987570,3000,14
598,"삼성전자 BESPOKE 그랑데 AI 직렬설치 세탁기 + 건조기 패키지 세트 WF21B6400KV7L 21kg + 17kg + 상단 설치 키트 방문설치, 블랙 캐비어, WF21B6400KV(세탁기), DV17B8720BV(건조기)",1633200,3000,14
