no, title, price, delivery_price, category 
1019,"메이튼 캐스퍼 전용 휴대폰 거치대, 1개, 블랙",20780,3000,22
1020,"UM2 차량용 PD3.1 고속 충전기 UMCH-165W-PD3.1, 블랙",32210,3000,22
1021,"신지모루 차량용 디스플레이 모니터 부착 거치대, 1개",18550,3000,22
1022,"알로코리아 60W 5포트 PD PPS C타입 초고속 멀티 충전기, 단일옵션, 1개",32500,3000,22
1023,"별다섯 이지마운트 스마트폰 태블릿 거치대 2단 흡착형, 혼합 색상, 1개",33600,3000,22
1024,"바넥스 전방FHD 후방HD 블랙박스, BX7W, 64GB",96790,3000,22
1025,"벨킨 부스트업 듀얼 USB C타입 차량용 고속 충전기, CCB002bt, 블랙",29900,3000,22
1026,"아우토링크 무선 미니 에어건 소형 차량 휴대용 청소기",97000,3000,22
1027,"파보니 세이프티 휴대용 알콜 음주측정기, 1개",78320,3000,22
1028,"로드몬스터 차량용 중력 거치대, 1개",13660,3000,22
1029,"마모스 차량용 미니 공기청정기, 화이트(MAC-100QV)",24100,3000,22
1030,"제노윈 자동차 차량용 대시보드 태블릿 스마트폰 거치대, 블랙, 1개",17210,3000,22
1031,"신지모루 오그랩 와이드 Z폴드 호환 15W 대화면 고속 무선충전 차량용 거치대, SOG_WIRE_WIDE_BK_SJM, 블랙",36040,3000,22
1032,"슈스 차량용 무선 에어건 청소기, V01, 화이트",26900,3000,22
1033,"슈피겐 원탭프로 맥세이프 차량용 고속 무선 거치대 대시보드형, ITS35W, 블랙",39950,3000,22
1034,"맥도도 차량용 헤드레스트 휴대폰 태블릿 거치대, 블랙, 1개",22500,3000,22
1035,"바넥스 전방FHD 후방HD 블랙박스, BX7W, 32GB",88000,3000,22
1036,"디씨네트워크 차량용 마그네틱 360도 자석 거치대 탭형, 블랙, 2개",19940,3000,22
1037,"벨킨 부스트업 C타입 USB-A PPS PD 3.0 듀얼 차량용 충전기 37W CCB004bt, 1개, 블랙",29900,3000,22
1038,"엠피온 태양광보조충전거치대, SET-S30",18240,3000,22
1039,"메이튼 쏘렌토 MQ4 튜닝 용품 휴대폰 거치대, 1세트, 블랙",15000,3000,22
1040,"파인뷰 FHD/HD 2채널 블랙박스 X6 + 출장장착쿠폰 + GPS안테나, FineVu X6(블랙박스), 32GB",169000,3000,22
1041,"메이튼 쌍용 토레스 튜닝 용품 네비게이션 + 공조기 보호 필름 세트, 1세트, 투명",15900,3000,22
1042,"옵시디언 차량용 컵홀더 핸드폰 태블릿 거치대 마운트 CT-H24, 1개",17150,3000,22
1043,"나비 차량용 무선충전 거치대 NV102-FWC2Q, 블랙",37400,3000,22
1044,"디씨네트워크 월윈드 차량용 초강력 무선 에어건 휴대용 가정용 먼지제거 51000RPM, 블랙, DC Wb AG-01",38250,3000,22
1045,"메이튼 그랜저GN7 네비 공조기 보호 필름 세트, 1세트",18900,3000,22
1046,"삼에스 자동차 HUD 헤드업디스플레이 계기판 OBD/GPS겸용 M7, 12V, 1개",29500,3000,22
1047,"카멜레온360 가젯 차량용휴대폰거치대, CD슬롯 타입, 1개",18900,3000,22
1048,"ITUTN 차량용 에어건청소기 무선에어건 휴대용 자동차 충전식 미니 핸디, ZX-102",56200,3000,22
1049,"샤오미 미지아 차량용 핸디 청소기, SSXCQ01XY, 화이트",50320,3000,22
1050,"감비앤코 Z플립 호환 차량용 휴대폰 고속 무선 충전 거치대 CDC-20",33800,3000,22
1051,"캠프롱 맥스파워 프리미엄 시거잭 차량용 인버터 디지털타입 12V, 혼합색상",39800,3000,22
1052,"인포카 스위치 자동차 스캐너 IO180-OH android iOS동시호환 OBD2 / ELM327 / 자동차 진단기, 1개",57000,3000,22
1053,"옵시디언 차량용 핸드폰 맥 자석 거치대 갤럭시 아이폰 CT-M12, 1개",15150,3000,22
1054,"TUNAI FireFly LDAC 투나이 파이어플라이 차량용 블루투스 5.0 리시버, 1개",51500,3000,22
1055,"메이튼 투싼 NX4 풀체인지 튜닝 전용 핸드폰 거치대 H032, 1개",15000,3000,22
1056,"리드아이 프리미엄 하이패스 단말기, RF 프로, 블랙",43990,3000,22
1057,"메이튼 디올뉴 코나 SX2 차량용 핸드폰 거치대, 1개, 블랙",19240,3000,22
1058,"버바팀 45W PPS 완전 매립 C타입 듀얼포트 초미니 고속 차량용 충전기, 66883, 블랙",22290,3000,22
1059,"[쿠팡수입] 만듦 차량용 15W 스마트폰 무선 충전 거치대, 블랙, WT-K290",17920,3000,22
1060,"더존 Z폴드 & 플립5 호환 원터치 자동회전 듀얼코일 차량용 고속무선 충전거치대 TZ-Z400, 블랙",36480,3000,22
1061,"모락 네다 V9 120W PD 3포트 차량용 초고속 충전기",27760,3000,22
1062,"아이나비 전후방FHD 2채널 블랙박스 FXD8000 + 장착권 + GPS 안테나 세트, 64GB",229000,3000,22
1063,"베이직기어 차량용 태블릿 거치대 BG-CTM1, 1개, 혼합 색상",27790,3000,22
1064,"벨킨 부스트업 맥세이프 15W 차량용 무선 충전기 거치대, WIC008, 실버 그레이",129000,3000,22
1065,"오클립 캐스퍼전용 마운트 핸드폰 거치대 고속 무선충전기 세트구성, 세트 X500_캐스퍼 오클립, X500 무선충전기",48900,3000,22
1066,"신지모루 맥세이프 송풍구형 차량용 고속 무선 충전 거치대 + C타입 케이블, 블랙, 1개",29150,3000,22
1067,"조아스 차량용 에어건 청소기, JVC-2010, 블랙",39800,3000,22
1068,"아이코모스 퀵차지3.0 듀얼 릴타입 고속 차량용 충전기, RCC03-C5 (C타입+5핀+8핀젠더), 블랙",19650,3000,22
1069,"카슈아 차량용 맥세이프 LED 휴대폰 고속 무선 충전 거치대 CO-HD02, 블랙",39900,3000,22
1070,"신지모루 볼리 마그네틱 차량용 볼 거치대, 블랙, 1개",13900,3000,22
1071,"코시 차량용 C타입 원터치 자동감김 USB 2포트 고속 충전기 90cm, CGR4079AT, 블랙",18740,3000,22
1072,"티패스 무선 하이패스 단말기 TL-720S PLUS, TL-720S PLUS 블랙",41800,3000,22
1073,"비잽 45W 듀얼 C타입 차량용 초미니 시거잭 초고속 충전기 매립형 PD PPS QC5.0, BZDC45, 블랙",17340,3000,22
1074,"만도 건전지형 무선 하이패스, AP350S, 실버",44900,3000,22
1075,"아이나비 전후방FHD 2채널 블랙박스 FXD8000 + 장착권 + GPS 안테나 세트, 32GB",189000,3000,22
1076,"컴스마트 차량용 프리미엄 LCD IPS 패널 Full HD 1080P 블랙박스 GF502S, 32GB",28900,3000,22
1077,"신지모루 오 그랩 엑스 차량용 무선 충전거 치대 + 고속충전 퀄컴3.0 듀얼포트 차량용 충전기, 블랙",36870,3000,22
1078,"비잽 20W 듀얼코일 차량용 고속 무선충전 거치대, BZCW-G20W, 블랙",21980,3000,22
